### ISSUE TITLE
[Bug]: Queries for sanejs.circl.lu and cppz.circl.lu going out after deactivation

### ISSUE THREAD

**Issue by gdesmar** [Lookyloo/lookyloo#1093]
### What happened?

I am trying to control or deactivate everything, but Lookylook still does DNS queries for both of those domains.
The sanejs subdomain doesn't look to be resolved completely and therefore does not show any communications, it is still uncertain why the resolution is needed after successfully detecting sanejs' deactivation, as seen in the log: `SaneJavaScript INFO:Not enabled.`.
The cppz subdomain does resolve and a series of communications happens after.

What is causing those communications and how can we control them (either to use a proxy, or to deactivate them)?

To reproduce (and see) the issue, a minimum of two terminals are needed. In the first terminal, execute the following:
```bash
docker run --rm --name lookyloo --entrypoint /bin/bash -it python:3.11-slim-bookworm
```
Then all of those following commands, one at a time, in the container:
```bash
apt-get update && apt-get -yy upgrade && apt-get install -yy libffi8 libfuzzy2 libmagic1 git && rm -rf /var/lib/apt/lists/*
apt-get update && apt-get install -y --no-install-recommends build-essential ffmpeg && rm -rf /var/lib/apt/lists/*
pip install poetry
cd /opt && \
    git clone https://github.com/valkey-io/valkey && \
    cd valkey && \
    git checkout 8.0 && \
    make
cd /opt && \
    git clone https://github.com/Lookyloo/lookyloo.git && \
    cd lookyloo && \
    mkdir -p cache user_agents scraped logs && \
    poetry install && \
    echo LOOKYLOO_HOME="'`pwd`'" > .env && \
    poetry run playwright install-deps && \
    cp /opt/lookyloo/config/modules.json.sample /opt/lookyloo/config/modules.json && \
    sed -i 's/"enabled": true,/"enabled": false,/g' /opt/lookyloo/config/modules.json && \
    poetry run update --yes
pip install pylookyloo
```
From my tests, after those commands Lookyloo will have already started in the main container. If it is not the case, we can start it manually after executng the next step, to make sure we have all communication logs.
In the second terminal, the following tcpdump can be executed:
```bash
docker run -it --rm --net container:lookyloo nicolaka/netshoot tcpdump
```
Back to the first terminal, we can now cause a Lookyloo query to happen:
```python
python
import pylookyloo
proxy = <USE PROXY IF NEEDED>
lookyloo = pylookyloo.Lookyloo(root_url="http://127.0.0.1:5100")
lookyloo.submit(url="http://perdu.com", quiet=True, proxy=proxy)
```

### Relevant log output

```shell
14:16:23.451767 IP 8f9b1f9a47fe.57915 > mydnsresolver.53: 36388+ A? sanejs.circl.lu. (33)
14:16:23.451843 IP 8f9b1f9a47fe.57915 > mydnsresolver.53: 44327+ AAAA? sanejs.circl.lu. (33)
14:16:23.472116 IP mydnsresolver.53 > 8f9b1f9a47fe.57915: 44327 2/0/0 CNAME cppz.circl.lu., AAAA 2a00:5980:93::128 (80)
14:16:23.537561 IP mydnsresolver.53 > 8f9b1f9a47fe.57915: 36388 2/0/0 CNAME cppz.circl.lu., A 185.194.93.128 (68)
14:16:23.538023 IP 8f9b1f9a47fe.55360 > cppz.circl.lu.443: Flags [S], seq 3163885156, win 64240, options [mss 1460,sackOK,TS val 3288230136 ecr 0,nop,wscale 7], length 0
14:16:23.626177 IP 8f9b1f9a47fe.33843 > mydnsresolver.53: 49786+ PTR? 128.93.194.185.in-addr.arpa. (45)
14:16:23.650615 IP cppz.circl.lu.443 > 8f9b1f9a47fe.55360: Flags [S.], seq 3040845154, ack 3163885157, win 65160, options [mss 1410,sackOK,TS val 507033401 ecr 3288230136,nop,wscale 7], length 0
14:16:23.650638 IP 8f9b1f9a47fe.55360 > cppz.circl.lu.443: Flags [.], ack 1, win 502, options [nop,nop,TS val 3288230248 ecr 507033401], length 0
14:16:23.651351 IP 8f9b1f9a47fe.55360 > cppz.circl.lu.443: Flags [P.], seq 1:518, ack 1, win 502, options [nop,nop,TS val 3288230249 ecr 507033401], length 517
14:16:23.761525 IP cppz.circl.lu.443 > 8f9b1f9a47fe.55360: Flags [.], ack 518, win 506, options [nop,nop,TS val 507033513 ecr 3288230249], length 0
14:16:23.767770 IP cppz.circl.lu.443 > 8f9b1f9a47fe.55360: Flags [P.], seq 1:2773, ack 518, win 506, options [nop,nop,TS val 507033519 ecr 3288230249], length 2772
14:16:23.767788 IP 8f9b1f9a47fe.55360 > cppz.circl.lu.443: Flags [.], ack 2773, win 491, options [nop,nop,TS val 3288230365 ecr 507033519], length 0
14:16:23.767790 IP cppz.circl.lu.443 > 8f9b1f9a47fe.55360: Flags [P.], seq 2773:3577, ack 518, win 506, options [nop,nop,TS val 507033519 ecr 3288230249], length 804
14:16:23.767794 IP 8f9b1f9a47fe.55360 > cppz.circl.lu.443: Flags [.], ack 3577, win 485, options [nop,nop,TS val 3288230365 ecr 507033519], length 0
14:16:23.770307 IP 8f9b1f9a47fe.55360 > cppz.circl.lu.443: Flags [P.], seq 518:598, ack 3577, win 501, options [nop,nop,TS val 3288230368 ecr 507033519], length 80
14:16:23.770798 IP 8f9b1f9a47fe.55360 > cppz.circl.lu.443: Flags [P.], seq 598:830, ack 3577, win 501, options [nop,nop,TS val 3288230368 ecr 507033519], length 232
14:16:23.770857 IP 8f9b1f9a47fe.55360 > cppz.circl.lu.443: Flags [P.], seq 830:994, ack 3577, win 501, options [nop,nop,TS val 3288230369 ecr 507033519], length 164
14:16:23.880187 IP cppz.circl.lu.443 > 8f9b1f9a47fe.55360: Flags [.], ack 598, win 506, options [nop,nop,TS val 507033631 ecr 3288230368], length 0
14:16:23.880252 IP cppz.circl.lu.443 > 8f9b1f9a47fe.55360: Flags [.], ack 830, win 505, options [nop,nop,TS val 507033632 ecr 3288230368], length 0
14:16:23.880332 IP cppz.circl.lu.443 > 8f9b1f9a47fe.55360: Flags [P.], seq 3577:3880, ack 830, win 505, options [nop,nop,TS val 507033632 ecr 3288230368], length 303
14:16:23.880453 IP cppz.circl.lu.443 > 8f9b1f9a47fe.55360: Flags [.], ack 994, win 504, options [nop,nop,TS val 507033632 ecr 3288230369], length 0
14:16:23.880461 IP cppz.circl.lu.443 > 8f9b1f9a47fe.55360: Flags [P.], seq 3880:4183, ack 994, win 504, options [nop,nop,TS val 507033632 ecr 3288230369], length 303
14:16:23.880606 IP 8f9b1f9a47fe.55360 > cppz.circl.lu.443: Flags [.], ack 4183, win 501, options [nop,nop,TS val 3288230478 ecr 507033632], length 0
14:16:23.884923 IP cppz.circl.lu.443 > 8f9b1f9a47fe.55360: Flags [P.], seq 4183:4451, ack 994, win 504, options [nop,nop,TS val 507033636 ecr 3288230369], length 268
14:16:23.925943 IP 8f9b1f9a47fe.55360 > cppz.circl.lu.443: Flags [.], ack 4451, win 501, options [nop,nop,TS val 3288230524 ecr 507033636], length 0
14:16:23.962546 IP mydnsresolver.53 > 8f9b1f9a47fe.33843: 49786 1/0/0 PTR cppz.circl.lu. (72)
14:16:28.367272 IP cppz.circl.lu.443 > 8f9b1f9a47fe.55360: Flags [P.], seq 4451:4475, ack 994, win 504, options [nop,nop,TS val 507038118 ecr 3288230524], length 24
14:16:28.367293 IP 8f9b1f9a47fe.55360 > cppz.circl.lu.443: Flags [.], ack 4475, win 501, options [nop,nop,TS val 3288234965 ecr 507038118], length 0
14:16:28.367295 IP cppz.circl.lu.443 > 8f9b1f9a47fe.55360: Flags [F.], seq 4475, ack 994, win 504, options [nop,nop,TS val 507038118 ecr 3288230524], length 0
14:16:28.409888 IP 8f9b1f9a47fe.55360 > cppz.circl.lu.443: Flags [.], ack 4476, win 501, options [nop,nop,TS val 3288235008 ecr 507038118], length 0
14:16:58.365162 IP cppz.circl.lu.443 > 8f9b1f9a47fe.55360: Flags [R.], seq 4476, ack 994, win 504, options [nop,nop,TS val 507068118 ecr 3288235008], length 0
```
